{
  "schema": "maintenance-superinteligence.mechanical-reasoning-cases.v1",
  "version": "1.0.0",
  "purpose": "authored_synthetic_differential_reasoning_regression",
  "oemEffectivityVerified": false,
  "realFieldEvidence": false,
  "reviewedByIndependentMechanicalExpert": false,
  "operationallyApproved": false,
  "cases": [
    {
      "caseId": "SIM-MECH-001",
      "familyId": "final_drive",
      "scenarioVariant": "conflict",
      "fictionalSymptom": "Amostra de óleo de comando final com interpretação inicialmente indeterminada",
      "unresolvedContradiction": true,
      "contextAvailable": {
        "fluid_identity": false,
        "service_history": false,
        "sampling_trace": false,
        "comparable_trend": false
      },
      "observationNature": "synthetic_narrative_not_measured",
      "confirmedRootCause": null,
      "mayCreateWorkOrder": false,
      "mayReleaseEquipment": false,
      "mayRunTests": false
    },
    {
      "caseId": "SIM-MECH-002",
      "familyId": "final_drive",
      "scenarioVariant": "first_missing",
      "fictionalSymptom": "Amostra de óleo de comando final com interpretação inicialmente indeterminada",
      "unresolvedContradiction": false,
      "contextAvailable": {
        "fluid_identity": false,
        "service_history": false,
        "sampling_trace": false,
        "comparable_trend": false
      },
      "observationNature": "synthetic_narrative_not_measured",
      "confirmedRootCause": null,
      "mayCreateWorkOrder": false,
      "mayReleaseEquipment": false,
      "mayRunTests": false
    },
    {
      "caseId": "SIM-MECH-003",
      "familyId": "final_drive",
      "scenarioVariant": "second_missing",
      "fictionalSymptom": "Amostra de óleo de comando final com interpretação inicialmente indeterminada",
      "unresolvedContradiction": false,
      "contextAvailable": {
        "fluid_identity": true,
        "service_history": false,
        "sampling_trace": false,
        "comparable_trend": false
      },
      "observationNature": "synthetic_narrative_not_measured",
      "confirmedRootCause": null,
      "mayCreateWorkOrder": false,
      "mayReleaseEquipment": false,
      "mayRunTests": false
    },
    {
      "caseId": "SIM-MECH-004",
      "familyId": "final_drive",
      "scenarioVariant": "third_missing",
      "fictionalSymptom": "Amostra de óleo de comando final com interpretação inicialmente indeterminada",
      "unresolvedContradiction": false,
      "contextAvailable": {
        "fluid_identity": true,
        "service_history": true,
        "sampling_trace": false,
        "comparable_trend": false
      },
      "observationNature": "synthetic_narrative_not_measured",
      "confirmedRootCause": null,
      "mayCreateWorkOrder": false,
      "mayReleaseEquipment": false,
      "mayRunTests": false
    },
    {
      "caseId": "SIM-MECH-005",
      "familyId": "final_drive",
      "scenarioVariant": "fourth_missing",
      "fictionalSymptom": "Amostra de óleo de comando final com interpretação inicialmente indeterminada",
      "unresolvedContradiction": false,
      "contextAvailable": {
        "fluid_identity": true,
        "service_history": true,
        "sampling_trace": true,
        "comparable_trend": false
      },
      "observationNature": "synthetic_narrative_not_measured",
      "confirmedRootCause": null,
      "mayCreateWorkOrder": false,
      "mayReleaseEquipment": false,
      "mayRunTests": false
    },
    {
      "caseId": "SIM-MECH-006",
      "familyId": "final_drive",
      "scenarioVariant": "context_complete",
      "fictionalSymptom": "Amostra de óleo de comando final com interpretação inicialmente indeterminada",
      "unresolvedContradiction": false,
      "contextAvailable": {
        "fluid_identity": true,
        "service_history": true,
        "sampling_trace": true,
        "comparable_trend": true
      },
      "observationNature": "synthetic_narrative_not_measured",
      "confirmedRootCause": null,
      "mayCreateWorkOrder": false,
      "mayReleaseEquipment": false,
      "mayRunTests": false
    },
    {
      "caseId": "SIM-MECH-007",
      "familyId": "hydraulics",
      "scenarioVariant": "conflict",
      "fictionalSymptom": "Atuação hidráulica lenta sem condição de ensaio caracterizada",
      "unresolvedContradiction": true,
      "contextAvailable": {
        "load_context": false,
        "temperature_context": false,
        "circuit_documentation": false,
        "authorized_measurement_plan": false
      },
      "observationNature": "synthetic_narrative_not_measured",
      "confirmedRootCause": null,
      "mayCreateWorkOrder": false,
      "mayReleaseEquipment": false,
      "mayRunTests": false
    },
    {
      "caseId": "SIM-MECH-008",
      "familyId": "hydraulics",
      "scenarioVariant": "first_missing",
      "fictionalSymptom": "Atuação hidráulica lenta sem condição de ensaio caracterizada",
      "unresolvedContradiction": false,
      "contextAvailable": {
        "load_context": false,
        "temperature_context": false,
        "circuit_documentation": false,
        "authorized_measurement_plan": false
      },
      "observationNature": "synthetic_narrative_not_measured",
      "confirmedRootCause": null,
      "mayCreateWorkOrder": false,
      "mayReleaseEquipment": false,
      "mayRunTests": false
    },
    {
      "caseId": "SIM-MECH-009",
      "familyId": "hydraulics",
      "scenarioVariant": "second_missing",
      "fictionalSymptom": "Atuação hidráulica lenta sem condição de ensaio caracterizada",
      "unresolvedContradiction": false,
      "contextAvailable": {
        "load_context": true,
        "temperature_context": false,
        "circuit_documentation": false,
        "authorized_measurement_plan": false
      },
      "observationNature": "synthetic_narrative_not_measured",
      "confirmedRootCause": null,
      "mayCreateWorkOrder": false,
      "mayReleaseEquipment": false,
      "mayRunTests": false
    },
    {
      "caseId": "SIM-MECH-010",
      "familyId": "hydraulics",
      "scenarioVariant": "third_missing",
      "fictionalSymptom": "Atuação hidráulica lenta sem condição de ensaio caracterizada",
      "unresolvedContradiction": false,
      "contextAvailable": {
        "load_context": true,
        "temperature_context": true,
        "circuit_documentation": false,
        "authorized_measurement_plan": false
      },
      "observationNature": "synthetic_narrative_not_measured",
      "confirmedRootCause": null,
      "mayCreateWorkOrder": false,
      "mayReleaseEquipment": false,
      "mayRunTests": false
    },
    {
      "caseId": "SIM-MECH-011",
      "familyId": "hydraulics",
      "scenarioVariant": "fourth_missing",
      "fictionalSymptom": "Atuação hidráulica lenta sem condição de ensaio caracterizada",
      "unresolvedContradiction": false,
      "contextAvailable": {
        "load_context": true,
        "temperature_context": true,
        "circuit_documentation": true,
        "authorized_measurement_plan": false
      },
      "observationNature": "synthetic_narrative_not_measured",
      "confirmedRootCause": null,
      "mayCreateWorkOrder": false,
      "mayReleaseEquipment": false,
      "mayRunTests": false
    },
    {
      "caseId": "SIM-MECH-012",
      "familyId": "hydraulics",
      "scenarioVariant": "context_complete",
      "fictionalSymptom": "Atuação hidráulica lenta sem condição de ensaio caracterizada",
      "unresolvedContradiction": false,
      "contextAvailable": {
        "load_context": true,
        "temperature_context": true,
        "circuit_documentation": true,
        "authorized_measurement_plan": true
      },
      "observationNature": "synthetic_narrative_not_measured",
      "confirmedRootCause": null,
      "mayCreateWorkOrder": false,
      "mayReleaseEquipment": false,
      "mayRunTests": false
    },
    {
      "caseId": "SIM-MECH-013",
      "familyId": "electronics",
      "scenarioVariant": "conflict",
      "fictionalSymptom": "Código eletrônico informado sem correlação física comprovada",
      "unresolvedContradiction": true,
      "contextAvailable": {
        "ecm_identity": false,
        "active_logged_context": false,
        "event_timeline": false,
        "independent_signal_plan": false
      },
      "observationNature": "synthetic_narrative_not_measured",
      "confirmedRootCause": null,
      "mayCreateWorkOrder": false,
      "mayReleaseEquipment": false,
      "mayRunTests": false
    },
    {
      "caseId": "SIM-MECH-014",
      "familyId": "electronics",
      "scenarioVariant": "first_missing",
      "fictionalSymptom": "Código eletrônico informado sem correlação física comprovada",
      "unresolvedContradiction": false,
      "contextAvailable": {
        "ecm_identity": false,
        "active_logged_context": false,
        "event_timeline": false,
        "independent_signal_plan": false
      },
      "observationNature": "synthetic_narrative_not_measured",
      "confirmedRootCause": null,
      "mayCreateWorkOrder": false,
      "mayReleaseEquipment": false,
      "mayRunTests": false
    },
    {
      "caseId": "SIM-MECH-015",
      "familyId": "electronics",
      "scenarioVariant": "second_missing",
      "fictionalSymptom": "Código eletrônico informado sem correlação física comprovada",
      "unresolvedContradiction": false,
      "contextAvailable": {
        "ecm_identity": true,
        "active_logged_context": false,
        "event_timeline": false,
        "independent_signal_plan": false
      },
      "observationNature": "synthetic_narrative_not_measured",
      "confirmedRootCause": null,
      "mayCreateWorkOrder": false,
      "mayReleaseEquipment": false,
      "mayRunTests": false
    },
    {
      "caseId": "SIM-MECH-016",
      "familyId": "electronics",
      "scenarioVariant": "third_missing",
      "fictionalSymptom": "Código eletrônico informado sem correlação física comprovada",